{
  "$schema": "http://json-schema.org/draft-07/schema#",
  "definitions": {
    "positiveNumber": {
      "type": "number",
      "minimum": 0
    },
    "xyzArray": {
      "type": "array",
      "description": "Array of 3 numbers, [x, y, z]",
      "items": { "type": "number" },
      "minItems": 3,
      "maxItems": 3
    },
    "liquidHandlingSpecs": {
      "description": "Object containing linear equations for translating between uL of liquid and mm of plunger travel. There is one linear equation for aspiration and one for dispense",
      "type": "object",
      "required": ["aspirate", "dispense"],
      "additionalProperties": false,
      "properties": {
        "aspirate": { "$ref": "#/definitions/xyzArray" },
        "dispense": { "$ref": "#/definitions/xyzArray" }
      }
    },
    "flowRate": {
      "description": "Object with a default value and optional dict keyed by api level. If API level is unavailable, default is used.",
      "type": "object",
      "required": ["default", "valuesByApiLevel"],
      "properties": {
        "default": {
          "$ref": "#/definitions/positiveNumber",
          "$comment": "The default value of the flowrate"
        },
        "valuesByApiLevel": { "type": "object", "required": [] }
      }
    }
  },
  "type": "object",
  "required": [
    "$otSharedSchema",
    "maxVolume",
    "minVolume",
    "defaultTipracks",
    "supportedTips",
    "defaultTipOverlapDictionary"
  ],
  "additionalProperties": false,
  "properties": {
    "$otSharedSchema": {
      "type": "string",
      "description": "The path to a valid Opentrons shared schema relative to the shared-data directory, without its extension. For instance, #/pipette/schemas/2/pipetteLiquidPropertiesSchema.json is a reference to this schema."
    },
    "supportedTips": {
      "type": "object",
      "description": "A container of supported tip types",
      "properties": {
        "patternProperties": {
          "description": "Tip specific liquid handling properties for a given pipette. Using the active tip on a pipette, we will look up the pipetting configurations associated with that tip+pipette combo.",
          "type": "object",
          "$comment": "Example key: 't50'",
          "^t[0-9]{2,4}": {
            "required": [
              "defaultAspirateFlowRate",
              "defaultDispenseFlowRate",
              "defaultBlowOutFlowRate",
              "aspirate",
              "dispense"
            ],
            "properties": {
              "defaultAspirateFlowRate": {
                "$ref": "#/definitions/flowRate",
                "$comment": "for lowVolumeDefault only, the flowRate matches the uiMaxFlowRate. This does not change physical behavior and was made for UI purposes"
              },
              "defaultDispenseFlowRate": {
                "$ref": "#/definitions/flowRate",
                "$comment": "for lowVolumeDefault only, the flowRate matches the uiMaxFlowRate. This does not change physical behavior and was made for UI purposes"
              },
              "defaultBlowOutFlowRate": {
                "$ref": "#/definitions/flowRate",
                "$comment": "for lowVolumeDefault only, the flowRate matches the uiMaxFlowRate. This does not change physical behavior and was made for UI purposes"
              },
              "defaultFlowAcceleration": {
                "$ref": "#/definitions/positiveNumber"
              },
              "defaultTipLength": {
                "$ref": "#/definitions/positiveNumber"
              },
              "defaultReturnTipHeight": {
                "$ref": "#/definitions/positiveNumber"
              },
              "aspirate": {
                "type": "array",
                "items": { "$ref": "#/definitions/liquidHandlingSpecs" }
              },
              "dispense": {
                "type": "array",
                "items": { "$ref": "#/definitions/liquidHandlingSpecs" }
              },
              "uiMaxFlowRate": {
                "$ref": "#/definitions/positiveNumber",
                "$comment": "To be used in frontend applications only since it is the limit-to-lowest-max",
                "description": "An optional number to represent each pipette's supported tip max flow rate for aspirate and dispense. The limit is the lowest max flow rate given all the tip's volumes minus 2% for safety."
              }
            }
          }
        }
      }
    },
    "defaultTipOverlapDictionary": {
      "type": "object",
      "description": "Map of tip overlap values with defaults",
      "required": ["default"],
      "$comment": "Other keys in here should be labware URIs",
      "properties": {
        "default": { "type": "number" }
      },
      "additionalProperties": { "type": "number" }
    },
    "maxVolume": { "$ref": "#/definitions/positiveNumber" },
    "minVolume": { "$ref": "#/definitions/positiveNumber" },
    "defaultTipracks": {
      "type": "array",
      "items": {
        "type": "string"
      }
    }
  }
}
