{
  "$otSharedSchema": "#/pipette/schemas/2/pipetteLiquidPropertiesSchema.json",
  "supportedTips": {
    "t50": {
      "uiMaxFlowRate": 194,
      "defaultAspirateFlowRate": {
        "default": 6,
        "valuesByApiLevel": { "2.14": 6 }
      },
      "defaultDispenseFlowRate": {
        "default": 6,
        "valuesByApiLevel": { "2.14": 6 }
      },
      "defaultBlowOutFlowRate": {
        "default": 80,
        "valuesByApiLevel": { "2.14": 80 }
      },
      "defaultFlowAcceleration": 16000.0,
      "defaultTipLength": 57.9,
      "defaultReturnTipHeight": 0.2,
      "aspirate": {
        "default": {
          "1": [
            [1.9733, 2.7039, 5.1258],
            [2.88, 1.0915, 8.3077],
            [3.7642, 0.5906, 9.7502],
            [4.9783, 1.0072, 8.1822],
            [5.9342, 0.2998, 11.7038],
            [6.8708, 0.1887, 12.3626],
            [7.8092, 0.1497, 12.631],
            [8.7525, 0.1275, 12.804],
            [13.4575, 0.0741, 13.2718],
            [22.8675, 0.0296, 13.87],
            [37.0442, 0.0128, 14.2551],
            [55.4792, -0.0013, 14.7754]
          ]
        }
      },
      "dispense": {
        "default": {
          "1": [
            [1.9733, 2.7039, 5.1258],
            [2.88, 1.0915, 8.3077],
            [3.7642, 0.5906, 9.7502],
            [4.9783, 1.0072, 8.1822],
            [5.9342, 0.2998, 11.7038],
            [6.8708, 0.1887, 12.3626],
            [7.8092, 0.1497, 12.631],
            [8.7525, 0.1275, 12.804],
            [13.4575, 0.0741, 13.2718],
            [22.8675, 0.0296, 13.87],
            [37.0442, 0.0128, 14.2551],
            [55.4792, -0.0013, 14.7754]
          ]
        }
      },
      "defaultPushOutVolume": 7
    },
    "t200": {
      "uiMaxFlowRate": 194,
      "defaultAspirateFlowRate": {
        "default": 80,
        "valuesByApiLevel": { "2.14": 80 }
      },
      "defaultDispenseFlowRate": {
        "default": 80,
        "valuesByApiLevel": { "2.14": 80 }
      },
      "defaultBlowOutFlowRate": {
        "default": 80,
        "valuesByApiLevel": { "2.14": 80 }
      },
      "defaultFlowAcceleration": 16000.0,
      "defaultTipLength": 58.35,
      "defaultReturnTipHeight": 0.2,
      "aspirate": {
        "default": {
          "1": [
            [1.9331, 3.4604, 3.5588],
            [2.9808, 1.5307, 7.2892],
            [3.9869, 0.825, 9.3926],
            [4.9762, 0.5141, 10.6323],
            [5.9431, 0.3232, 11.5819],
            [6.9223, 0.2644, 11.9317],
            [7.8877, 0.1832, 12.4935],
            [8.8562, 0.1512, 12.7463],
            [47.7169, 0.0281, 13.836],
            [95.63, 0.0007, 15.147],
            [211.1169, 0.0005, 15.1655]
          ]
        }
      },
      "dispense": {
        "default": {
          "1": [
            [1.9331, 3.4604, 3.5588],
            [2.9808, 1.5307, 7.2892],
            [3.9869, 0.825, 9.3926],
            [4.9762, 0.5141, 10.6323],
            [5.9431, 0.3232, 11.5819],
            [6.9223, 0.2644, 11.9317],
            [7.8877, 0.1832, 12.4935],
            [8.8562, 0.1512, 12.7463],
            [47.7169, 0.0281, 13.836],
            [95.63, 0.0007, 15.147],
            [211.1169, 0.0005, 15.1655]
          ]
        }
      },
      "defaultPushOutVolume": 5
    },
    "t1000": {
      "uiMaxFlowRate": 187.2,
      "defaultAspirateFlowRate": {
        "default": 160,
        "valuesByApiLevel": { "2.14": 160 }
      },
      "defaultDispenseFlowRate": {
        "default": 160,
        "valuesByApiLevel": { "2.14": 160 }
      },
      "defaultBlowOutFlowRate": {
        "default": 80,
        "valuesByApiLevel": { "2.14": 80 }
      },
      "defaultFlowAcceleration": 16000.0,
      "defaultTipLength": 95.6,
      "defaultReturnTipHeight": 0.2,
      "aspirate": {
        "default": {
          "1": [
            [3.9, 1.789, 5.4283],
            [5.6991, 0.3019, 11.2278],
            [8.5155, 0.2111, 11.7453],
            [13.1482, 0.0858, 12.8124],
            [17.8909, 0.0604, 13.1472],
            [46.0982, 0.0155, 13.9505],
            [93.5618, 0.0046, 14.4523],
            [112.5991, 0.0023, 14.6687],
            [189.5555, 0.002, 14.7035],
            [305.5891, 0.001, 14.887],
            [431.2836, 0.0004, 15.055],
            [625.0209, 0.0003, 15.1309],
            [818.6909, 0.0001, 15.2112],
            [963.9909, 0.0001, 15.2445],
            [992.0791, -0.0005, 15.7723],
            [1012.2118, 0.0007, 14.6701],
            [1037.1873, 0.0005, 14.8072]
          ]
        }
      },
      "dispense": {
        "default": {
          "1": [
            [3.9, 1.789, 5.4283],
            [5.6991, 0.3019, 11.2278],
            [8.5155, 0.2111, 11.7453],
            [13.1482, 0.0858, 12.8124],
            [17.8909, 0.0604, 13.1472],
            [46.0982, 0.0155, 13.9505],
            [93.5618, 0.0046, 14.4523],
            [112.5991, 0.0023, 14.6687],
            [189.5555, 0.002, 14.7035],
            [305.5891, 0.001, 14.887],
            [431.2836, 0.0004, 15.055],
            [625.0209, 0.0003, 15.1309],
            [818.6909, 0.0001, 15.2112],
            [963.9909, 0.0001, 15.2445],
            [992.0791, -0.0005, 15.7723],
            [1012.2118, 0.0007, 14.6701],
            [1037.1873, 0.0005, 14.8072]
          ]
        }
      },
      "defaultPushOutVolume": 20
    }
  },
  "defaultTipOverlapDictionary": {
    "default": 10.5,
    "opentrons/opentrons_flex_96_tiprack_50ul/1": 10.5,
    "opentrons/opentrons_flex_96_tiprack_1000ul/1": 10.5,
    "opentrons/opentrons_flex_96_tiprack_200ul/1": 10.5
  },
  "maxVolume": 1000,
  "minVolume": 5,
  "defaultTipracks": [
    "opentrons/opentrons_flex_96_tiprack_1000ul/1",
    "opentrons/opentrons_flex_96_tiprack_200ul/1",
    "opentrons/opentrons_flex_96_tiprack_50ul/1"
  ]
}
